Id,Title,Summary
https://www.wantedly.com/projects/1232051,メタバースの新しい技術基盤を構築するサーバーサイドエンジニア募集,ambrは、仮想世界及びバーチャルプロダクトを創造する会社です。 バーチャルの進展は通信技術やハードウェアの進化に伴う不可逆な変化です。 その中で、バーチャルならではの体験／プロダクトつくりの技術を持つ企業はまだほとんどありません。 ...
https://www.wantedly.com/projects/292340,ユーザーにいち早く価値を届けることができる開発体制！エンジニア大募集,クックパッドライブでは「料理を楽しみにする」ための課題解決型サービスをスピードにこだわって開発していきます。 クックパッドライブでのサービス開発は、とても速いスピードで意思決定が行われ、トライアル、立ち上げ、方針転換、撤退が速やかに...
https://www.wantedly.com/projects/1191579,24卒エンジニア！自社サービス開発でフルスタックエンジニアを目指せる！,【社会になくてはならないインフラを創る】 システムのほとんどを社内のメンバーで開発、運用しています。サービスをカタチにしていく企画会議から技術戦略部のメンバーが参加することが多く、ただ言われたことを開発するだけでなく、エンジニアからの...
https://www.wantedly.com/projects/1338474,ペット業界の自社サービスをグロースさせるエンジニアを全国から募集！,■求める人材・人物像 ・Web開発、エンジニア経験、PHP経験が3年以上ある ・自社サービスを運営したい ・5人程度のチーム開発の経験がある ・コミュニケーションを取るのが好き ・楽しく仕事ができる ・プログラミングが好き ■エンジ...
https://www.wantedly.com/projects/1121955,自社アプリ新規立ち上げ！Go言語で開発したいエンジニアインターン募集！,▼経験者採用 ・開発経験のある学生インターンの方向けの募集となります ▼募集ポジション ・Serverside Engineer ▼開発するプロダクト ・全く0からのド新規でプロダクトを立ち上げていきます ・領域はC2Cになります...
https://www.wantedly.com/projects/834647,GO言語でリアル×デジタルの新規マーケティングプラットフォーム開発！,新規プロダクトであるオンライン行動データとオフライン行動データを活用したマーケティングプラットフォーム開発に携わっていただきます。 現在、Supershipでは消費者のオフライン行動(位置情報やセンサー情報)とオンライン行動(web閲...
https://www.wantedly.com/projects/1315686,世の中を面白くする！バックエンドエンジニア/検索グロース担当募集！,"""世界中のあらゆるスペースをシェアできるプラットフォームを創る"" 私たちと一緒に、スペースシェアがあたりまえになるインフラサービスを創っていきませんか？ スペースマーケットにとって""検索の質はプロダクトの質""といえる領域。 スペース..."
https://www.wantedly.com/projects/881803,マイクロサービスアーキテクチャに興味があるバックエンドエンジニア募集中！,仕事内容は、当社サービスのバックエンド開発になります。 当社はユーザーの仕事選びに寄り添うサービスを複数開発・運用しています。サービスの新規開発、及び既存サービスの保守運用などの中で、得意領域を生かして一部または全部をご担当いただき...
https://www.wantedly.com/projects/503811,golang、Ruby、Pythonなんでも書ける理想のフルスタックへ！,具体的には自社サービス・クライアント向けWEB開発を担当してもらいます。次案件は次世代教育サービスを提供する計画でFlutterなど活用して幅広い世代に提供していきます。手掛けたサービスがスケールしていくことろを見れるのは楽しいですよ...
https://www.wantedly.com/projects/1226647,Golang/GraphQL 複業スタート！ソフトウェアエンジニア募集！,■募集する背景■ 事業売上が昨対比300%以上と拡大していく過程でさらなる成長を目指しており、プロダクトのグロース開発やその周辺の開発を進めていくにあたり、バックエンド領域においてリードしていただくソフトウェアエンジニアが僕たちには必...
https://www.wantedly.com/projects/632077,言語はGoとPython！自社サービス開発したいエンジニア大募集！,【概要】 コア事業であるECサイトのほか、アプリ開発や社内システムの開発など 多岐に渡ってご活躍いただけるフィールドがあります！ 入社後は、ECの裏側・表側・バリューチェーンに関わるテクノロジー全般の・導入・開発の全般を お願いいた...
https://www.wantedly.com/projects/1313859,自社プロダクト制作を手伝ってくれるGoエンジニア募集！,【募集概要】 当社では現在、自社プロダクト制作に協力していただける方を募集しています。 今回の募集では、未経験から初級者を対象としたGolangについての技術教材を執筆頂ける方を対象としています。 【お仕事の進め方】 教材執筆して...
https://www.wantedly.com/projects/1313724,Golangに興味があって自社プロダクト作りに協力してくれる方を募集！,【募集概要】 当社では現在、教育系自社プロダクトの開発を行っています。今回の募集では、その自社プロダクトで使用する、初級者向けの各種技術教材を執筆して頂ける方を募集しています。 週20時間ほど稼働してくれる方を探しています。稼働す...
https://www.wantedly.com/projects/263685,警備ロボット管理システムのバックエンド開発を行うエンジニアを求む!!,警備ロボットの製品化に向けて、今回はバックエンドエンジニアを募集します。 “いつか”社会の役に立つという長期のプロジェクトではなく、“すぐに”社会に役に立つ業務に携われるのは、エンジニアとしての高いモチベーションになるはずです。自動...
https://www.wantedly.com/projects/1305855,クリーンアーキテクチャで作るバックエンドGoエンジニア募集,【利用技術】 ・開発言語 TypeScript / Golang ・OS / ミドルウェア Linux / bullseye ・クラウド基盤 AWS ・サーバレス技術 Amplify / Lambda / ECS on Fargat...
https://www.wantedly.com/projects/1325086,Go言語｜億単位のデータ量に耐え得るプロダクトの開発リードを経験できます！,「つまらない常識を革め、おもしろく生きる人を世界中に」をパーパスに、オンラインでもリアルでもより価値ある接客が可能となり、スタッフさんがもっと評価される文化をつくり、「好きな仕事を続けていくことが難しい」という課題を解決するサービス「...
https://www.wantedly.com/projects/603476,空飛ぶクルマ/ドローン向けシステムのバックエンドエンジニア募集,"【概要】 テラドローン株式会社は、産業ドローンソリューションプロバイダーとして、世界トップクラスのシェアを誇る。大手ゼネコン・建設会社・測量会社等の案件を中心に、ドローン測量実績は1,200回以上。海外でも石油・ガス、電力、マイニング..."
https://www.wantedly.com/projects/1243956,Go言語エンジニア募集！,システムの設計・開発・保守・運用を実施していただきます。 様々なプロジェクトで経験を積んでもらい、ゆくゆくは自社の受託案件に携わっていただく想定です！ 設立間もない企業ということもあり、自走できる方を歓迎しています。 技術力に加え、...
https://www.wantedly.com/projects/1302507,魅力的な開発チームで働こう！Go言語でゲームを支えるエンジニア募集！,ゲーム開発事業においてクラウド環境（AWS）を基盤とした、バックエンドサーバー開発のチームメンバーを募集しています。Go言語に習熟した優れたエンジニアや、o11yを意識したバックエンドエンジニアの仲間が、活気に満ちた開発環境で一緒に働...
https://www.wantedly.com/projects/487653,メタバースプラットフォーム開発を加速させるソフトウェアエンジニアを募集中！,クラスター社の ミッション「人類の創造力を加速する」 ビジョン「バーチャル経済圏のインフラをつくる」 の実現には様々な技術の組み合わせが必要になります。 特定のスキルには収まらない、幅広くやりたい！という情熱のあるエンジニアを募集し...
https://www.wantedly.com/projects/1350807,柔軟な働き方が可能！東大発AIスタートアップでソフトウェアエンジニア募集！ NEW,＃副業OK ＃業務委託OK ＃システム開発 ＃ソフトウエアエンジニア ＃ソフトウェア開発 ＃機械学習 ＃画像解析 ＃深層学習 ＃AI ＃自社プロダクト ＃ヒューマンセンシング ＃TypeScript ＃Python ＃東大発スタート...
https://www.wantedly.com/projects/1244937,何かしらの開発経験があればOK！Go言語に挑戦するフリーランスエンジニア,【 概要 】Go言語によるシステム開発｜フルリモート可能 【 依頼内容 】 ・開発内容：ご本人のスキルによりポジションが変わるため依頼時に説明 例：Go言語によるブロックチェーン開発Pj ・依頼工程：要件定義/基本設計/詳細設計/...
https://www.wantedly.com/projects/609484,自由な働き方で事業サポート！Goエンジニア募集！,Goのエンジニアとしてフルリモート・フルフレックスの自由な環境で経験を活かしませんか？ 働きやすさはもちろんですが、社内にはベンチャーでCTO経験のあるエンジニアやOSSコミッターをはじめ、他にもスタートアップやメガベンチャー出身な...
https://www.wantedly.com/projects/1223419,HR Techサービスをグロースさせるエンジニア募集,「働くを」カラフルに を体現できるサービスを作っていきます。 今、皆さんが仕事を選ぶ中で色々な制約があると思います。その制約をなくすHRbase PROを作ることで、一緒にカラフルな社会にしていきます。 【役割】 WEBアプリケーシ...
https://www.wantedly.com/projects/1053188,"React×会員1,500万エンタメストリーミングアプリの開発・保守運用！","1,500万超の会員向けケータイキャリアのエンタメストリーミングサービスのReact化に従事していただきます。開発の他、保守運用のポジションもございます！ □■業務内容 React・Nuxt.js を利用した Web アプリケーショ..."
https://www.wantedly.com/projects/1323909,"Nuxt.js, Vue.js｜病院向けクラウド型オンラインカルテ開発🚀",【こんな方にオススメ】 ・フリーランスや副業として、長く心地よく働けるPJ を探したい ・カルチャーフィット感をはかりながら、働ける職場を探したい ・地方からフルリモートの環境で働きたい 【業務内容】 ■フロントエンドエンジニア i...
https://www.wantedly.com/projects/1145872,トヨタグループが提供するMaaSプラットフォームのバックエンドエンジニア,【my route開発グループについて】 my route開発グループでは、グループ会社であるトヨタファイナンシャルサービス株式会社の事業メンバーと共に、my routeの開発・運用に取り組んでおります。現在はシステムの安定化を図りな...
https://www.wantedly.com/projects/1199740,DDDで開発を推進！Goに興味があるバックエンドエンジニア募集,■背景 Gaudiyが展開しているコミュニティプラットフォームでは、認証基盤をはじめ、高い信頼性と長期的な運用を前提としたスケーラビリティが求められます。サービスの急成長に伴い、複雑な課題解決に対応するなかで、拡張性が高いとは言い難い...
https://www.wantedly.com/projects/1195720,バックエンドエンジニア_Go言語をメインで活用,募集ポジションについて 現在弊社では、既存タイトル約10本に加え、直近1年以内でさらに10本程度の新作を準備中。 また、日本国内だけでなく世界への配信を開始したことを受け、 ”より多くのユーザー”へ、”より質の高いサービス”を提供すべ...
https://www.wantedly.com/projects/1248470,ブロックチェーン×エンタメ領域で拡大するゲームベンチャーの技術者を募集！,副業として、プラチナエッグにジョインいただける方を募集しています！ ・もっとスキルアップしたい ・収入を増やしたい ・自分の好きな領域の開発に関わりたい などなど、理由や背景は問いません！ 「エンタメ×ブロックチェーンの領域で拡大...
https://www.wantedly.com/projects/1317531,フリーランス歓迎！人生のハンドルを自ら握るWEBエンジニア募集！,■ソフトウェア開発 開発案件に参画するエンジニアの募集です。フロントエンド / Jamstack / API開発を中心に、やりたいことを考慮して最適な仕事に携わっていただきます。 ■仕事内容 フロントエンド案件では、React / ...
https://www.wantedly.com/projects/1174062,医療ベンチャーで自社SaaSの新機能開発に携わりたい方！Goエンジニア募集,PHPで作られた既存サービスをGo言語へとリプレイスを進めつつ、新規プロダクトや新規機能もGo言語での開発も進めております。 【仕事内容】 ・PHPで開発された既存サービスをGo言語へリプレイス＆新機能開発を行っていただきます ■...
https://www.wantedly.com/projects/1171786,エンベデッドファイナンスAPIで保証を変える!バックエンドエンジニア求む!,□ウェブアプリケーション開発 1.開発関連: 実装・テストコード追加・レビュー・検証・リリース、などプロダクト開発に必要なことを横断的に行っていただきます 2.仕様検討: PdMとの協働など □開発環境の魅力 toC・toB両方の側...
https://www.wantedly.com/projects/1339688,ローソンアプリをgolangで開発するサーバーサイドエンジニアを募集,ローソンが提供する「ローソンアプリ」のバックエンド開発を担っていただきます。 【必須スキル・経験】 ・Webアプリケーション開発実務経験3年以上 ・RDB(MySQL)を利用した開発経験3年以上 ...
https://www.wantedly.com/projects/1170523,ファッション業界に革新的な接客体験を創造するバックエンドエンジニア募集！,＜チームについて＞ アパレル販売スタッフと顧客をつなげるデジタル接客アプリ「FAANS」のバックエンドの設計、実装、運用を行うチームです。 FAANSはアパレル販売スタッフの業務効率を最大化させ、オンラインとリアルの垣根を越え、服を求...
https://www.wantedly.com/projects/1328202,フロントエンドエンジニア｜eKYC｜本人確認APIの総合商社,■募集背景 私たちが取り組んでいる1つ目の事業は、toBの事業者向けeKYC/本人確認APIサービスです。「本人確認」に必要な様々な業務を分割・整理し、APIとして提供しています。私たちの顧客は本人確認が必要な全業界であり、毎日様々な...
https://www.wantedly.com/projects/1329169,ビジネス英会話をオンラインで。メイン事業の開発エンジニアWANTED！,弊社のメイン事業でもあるビジネス特化型オンライン英会話『Bizmates』のサービス企画/設計～コーディングまで、開発業務全般をお任せします。 英語教育×テクノロジーで急成長中の『Bizmates』のプロダクト開発を更に加速し、売上...
https://www.wantedly.com/projects/526361,PHPエンジニア│学びを起点に社会変革を生み出すプロダクトを作りませんか？,●仕事内容 当社のtoC向けサービス「Schoo」と法人向けサービス「Schooビジネスプラン」の開発を担当して頂きます。フロントエンドや各プロダクトチームと連携しながら、必要な機能を整理し拡張性を考慮した設計・実装を行っていきます。...
https://www.wantedly.com/projects/644629,TypeScript・AWSでサーバーレス開発をするEdTech企業!,【仕事内容】 教育×ITのサービスを展開するベンチャー企業でバックエンドエンジニアを募集！ 株式会社メイツでは「教育をアップデートする」ことを理念に教育アプリを開発し全国の教育現場に提供しております。 直近では2021年4月に教材アプ...
https://www.wantedly.com/projects/1274156,CTO直下！裁量を持って動画制作プロセスのDX化を担う、AIエンジニア募集,Wangetでは、サービスのクオリティのさらなる向上のため、動画制作プロセスのDX化を進めています。制作フローのDX化にあたり、そのコアとなるAIエンジン開発に向けてCTO直下でプロジェクト推進を担うAIエンジニアを募集します。 ▼...
https://www.wantedly.com/projects/506180,Go言語 + Next.jsで自社SaaSを開発したいエンジニア募集！,ビジネスパーソンが、新しい事業創造やチャレンジにに集中できる世界を技術で作りたい！アルファドライブが現在、計画・設計している新しい自社SaaSの立ち上げを一緒に担ってくれるプロダクト開発エンジニアを募集しています。 決められた仕様を開...
https://www.wantedly.com/projects/346338,GoやgRPC等自ら技術を取り入れプロダクト開発を推進するエンジニア募集,▼募集背景 「Mobile Tech for All（モバイルテクノロジーの民主化）」を実現するためには、新機能の開発に加え、40を超える既存機能の保守・運用をしていく必要があります。 Yappliの導入実績は 600アプリを超え、ユ...
https://www.wantedly.com/projects/1198346,TypeScript ｜Golang等モダン技術で活躍したいエンジニア募集,■ このポジションの説明 ■ 事業開発責任者やプロジェクトマネージャー、フロント/インフラエンジニアとのコミュニケーションを活発に取りながら、主としてバックエンドのアーキテクチャの設計・実装〜保守運用を担当していただきますが、一定量フ...
https://www.wantedly.com/projects/1314101,国内最大級のオンライン英会話学習サービスのプラットフォーム開発,国内最大級のオンライン英会話サービスである「レアジョブ英会話」をはじめとした、レアジョブグループが運営するサービスの共通基盤の設計・開発・運用をご担当頂きます。 Golang（Go言語）やマイクロサービスなど、積極的に新しい技術の選定...
https://www.wantedly.com/projects/1211743,マネーフォワードケッサイでGo言語でサービス開発したいエンジニア募集！,■募集背景 今回は弊社のコアである企業間後払い決済サービス事業において、技術選定・アーキテクチャ設計・アプリケーション開発などを通じて継続的かつ迅速に提供価値を高めていき、ご利用企業様が安心して取引できるようなサービスづくりをリード...
https://www.wantedly.com/projects/1324937,TypeScriptで不動産電子契約サービスを開発する不動産テック企業！,"ーフロントエンドエンジニアー 【業務内容】 Nextjs,React,TypeScriptを使った、新規事業開発。 【使用技術】 ・Nextjs ・Reactjs ・TypeScript ・Nestjs ・Nodejs ・MySQL..."
https://www.wantedly.com/projects/1328591,バックエンドエンジニア募集！資金調達額10.7億円ヘルスケアスタートアップ,◆東京美肌堂のバックエンド開発 ◆患者、医師、マーケ、CSなどの関係者の要望を吸い上げて要件を整理し、それに基づく機能の設計・開発 2023/1月現在、LATRICOでは以下の技術スタックで開発をしています ・PHP(Laravel...
https://www.wantedly.com/projects/1253310,新規事業！ライブゲームを開発するバックエンドエンジニア募集｜Go,【採用背景】 ミラティブでは「わかりあう願いをつなごう」をミッションにゲーム配信サービス『Mirrativ』の開発/運営を行っています。 Mirrativ はリリース以降、スマホ 1 台でライブ配信ができる手軽さが好評を博し、現在では...
https://www.wantedly.com/projects/881343,"Golang, React,TypeScript/技術の力でチームを牽引",「リモートで働きたい」 「プライベートの時間も充実させたい」 「レガシーな技術や属人化した環境を脱したい」 こんなお思いをお持ちのエンジニアご経験者には是非当社にご応募ください！ アイスリーデザインでは、社員が長期的に働けるよう様々...
https://www.wantedly.com/projects/791333,新規の0→１フェーズに挑戦！Go言語開発/サーバーサイドエンジニア募集！,新規電子マンガサービス開発にともなうサーバサイドの開発をお願いします。 大量トラフィック処理の効率化や開発、プロダクトのサーバサイドの設計を一から手がけていただきます。 0→１のサービス開発フェーズにチャレンジしてくれるエンジニアを募...
https://www.wantedly.com/projects/629565,24-25卒⋰Golangで自社開発！フルスタックエンジニアを目指す！,━━募集職種━━ スタートアップ企業で挑戦をしたいと考えている自社サービスのソフトウェア・エンジニア募集します。 応募資格： ・2024年、2025年3月末までに国内外の大学院、大学、高専を卒業見込・修了見込の方 (※専門学校卒を...
https://www.wantedly.com/projects/768662,GoxServerlessでSaaS開発！バックエンドエンジニア募集,現在当社が展開するSaaSサービスは数多くのお客さまにご利用いただいており、導入企業が日々増加しています。お客さまによりよいサービスを提供するため、プロダクトの更なるブラッシュアップは不可欠となっています。 現在10名（社員＆業務委託...
https://www.wantedly.com/projects/158384,孤独なGolangエンジニア募集、シニアコミュニティを支援する,当社サービス「おしるこ」をGolangで実装してみましょう！ 【おしるこについて】 「おしるこ」では、リアルではつながることが無かったであろう人と出会ったり、悩みを誰かに相談したり、自分の趣味や得意を発信出来たり、また得意なことで誰...
https://www.wantedly.com/projects/1323504,チームワーク重視の組織で活躍！自社プロダクトのサーバーサイド開発をお任せ,《Golangでの自社プロダクト開発に携われるサーバーサイドエンジニア》 アプリに特化した広告配信プラットフォーム「Circuit X」を作り上げるサーバーサイドエンジニアを募集します。マイクロサービス化の推進にも携われるポジション...
https://www.wantedly.com/projects/849142,Go言語｜タクシーアプリGOのWebアプリケーションエンジニア募集！,# 仕事内容 タクシー事業者向け業務支援管理画面、カスタマーサポート用画面等の開発をお任せします。 単に開発を行うだけではなく、サービスや機能の提案から設計・実装まで UI/UX にこだわってユーザーに新しい価値提供のチャレンジしてく...
https://www.wantedly.com/projects/533353,モビリティSaaSやプラットフォームを開発するバックエンドエンジニア募集！,弊社の自社サービスを提供する上でデータ解析の基盤となっている Data Platform の開発・運用、SmartDrive Fleet/Cars/Families といった Data Platform を利用した自社サービス群の開発...
https://www.wantedly.com/projects/1072607,場所に縛られない｜GO言語開発・AWSエンジニア募集！,今回募集するのはブロックチェーン関連（NFTサービス）の開発に携わって頂ける方を募集しています！ 働く時間や場所も自分で自由に決められます。 週2日だけ働きたい・業後だけ働きたいという方も相談可能。 NFTはまだまだアーリーアダプ...
